{
  "id": "v2x:1201:7",
  "class": "vehicle",
  "source": "v2x_relayed",
  "position": {
    "x": 25.0,
    "y": 1.2,
    "confidence": 0.9
  },
  "distance": 25.4,
  "speed": 15.2,
  "confidence": 0.95,
  "state": "tracked",
  "timestamps": {
    "measured": 1789000000200,
    "received": 1789000000200,
    "lastUpdated": 1789000000200
  }
}

